{
  "site": "tgbienew.cgg.gov.in",
  "audited_at": "2026-09-08T06:09:42.243976Z",
  "schema_version": "1.0.0",
  "generated_at": "2026-09-08T06:09:42.243976Z",
  "target_url": "https://tgbienew.cgg.gov.in/",
  "pages_audited": [
    "https://tgbienew.cgg.gov.in/"
  ],
  "audit_config": {
    "max_pages": 1,
    "timeout_seconds": 30,
    "skills_run": [
      "crawl-render-audit",
      "freshness-corroboration",
      "engagement-audit",
      "entity-disambiguation"
    ]
  },
  "summary": {
    "total_findings": 0,
    "critical": 0,
    "high": 0,
    "medium": 0,
    "low": 0,
    "critical_findings": 0,
    "high_findings": 0,
    "medium_findings": 0,
    "low_findings": 0,
    "total_flag_only": 1,
    "total_strengths": 0,
    "overall_health": "excellent",
    "category_scores": {
      "DV": 0,
      "FS": 0,
      "EN": 0,
      "ED": 0
    }
  },
  "findings": [],
  "flag_only_items": [
    {
      "id": "ED-05",
      "type": "flag_only",
      "reason": "No Wikipedia or Wikidata link found on https://tgbienew.cgg.gov.in/ for 'Tgbienew'. An external search step is required to determine whether a Wikipedia or Wikidata entry exists for this entity.",
      "recommendation": "Search Wikipedia for 'Tgbienew' and Wikidata for a Q-number. If an entry exists: add the URL to the Organization sameAs field to anchor entity identity. If no entry exists: consider creating a neutral, sourced Wikipedia stub or a Wikidata entry — this provides the strongest possible machine-readable identity signal for AI assistants.",
      "pages": [
        "https://tgbienew.cgg.gov.in/"
      ]
    }
  ],
  "strengths": [],
  "suggested_actions": [
    {
      "summary": "Publish an /llms.txt file at domain root listing key crawlable content and documentation.",
      "priority": "low",
      "detail": "/llms.txt is an emerging standard enabling AI crawlers to discover high-priority markdown and plain-text resources with minimal crawl overhead."
    }
  ]
}